{
  "$schema": "https://json-schema.org/draft/2020-12/schema",
  "$id": "https://rivet.local/contracts/component.schema.json",
  "title": "CatalogComponent",
  "description": "One catalog record. B owns; all consume. docs/implementation.md section 3.2. Unknown source data is null, never a guessed value. FROZEN v1.",
  "type": "object",
  "additionalProperties": false,
  "required": ["schema_version", "catalog_id", "identity", "physical", "mounts", "ports", "sourcing", "evidence"],
  "properties": {
    "schema_version": { "const": "1.0" },
    "catalog_id": { "$ref": "#/$defs/id" },
    "identity": {
      "type": "object",
      "additionalProperties": false,
      "required": ["manufacturer", "model", "sku", "category"],
      "properties": {
        "manufacturer": { "type": "string", "minLength": 1 },
        "model": { "type": "string", "minLength": 1 },
        "sku": { "type": ["string", "null"], "minLength": 1 },
        "category": {
          "enum": [
            "chassis",
            "motor",
            "wheel",
            "caster",
            "controller",
            "motor_driver",
            "distance_sensor",
            "power_supply",
            "switch",
            "wiring",
            "fastener",
            "accessory"
          ]
        }
      }
    },
    "physical": {
      "type": "object",
      "additionalProperties": false,
      "required": ["dimensions_mm", "mass_g", "bounds_verified", "geometry_kind", "asset_path", "material_preset"],
      "properties": {
        "dimensions_mm": {
          "type": "object",
          "additionalProperties": false,
          "required": ["x", "y", "z"],
          "properties": {
            "x": { "type": "number", "exclusiveMinimum": 0 },
            "y": { "type": "number", "exclusiveMinimum": 0 },
            "z": { "type": "number", "exclusiveMinimum": 0 }
          }
        },
        "mass_g": { "$ref": "#/$defs/non_negative_or_null" },
        "bounds_verified": { "type": "boolean" },
        "geometry_kind": { "enum": ["procedural", "glb"] },
        "asset_path": { "type": ["string", "null"] },
        "material_preset": { "type": "string" }
      },
      "if": { "properties": { "geometry_kind": { "const": "glb" } } },
      "then": { "properties": { "asset_path": { "type": "string", "minLength": 1 } } }
    },
    "mounts": {
      "type": "array",
      "items": {
        "type": "object",
        "additionalProperties": false,
        "required": ["mount_id", "kind", "position_mm", "rotation_deg", "allowed_mates"],
        "properties": {
          "mount_id": { "$ref": "#/$defs/id" },
          "kind": { "type": "string", "minLength": 1 },
          "position_mm": { "$ref": "#/$defs/vec3" },
          "rotation_deg": { "$ref": "#/$defs/vec3" },
          "allowed_mates": { "type": "array", "items": { "type": "string" } }
        }
      }
    },
    "ports": {
      "type": "array",
      "items": {
        "type": "object",
        "additionalProperties": false,
        "required": ["port_id", "signal", "voltage_min_v", "voltage_max_v", "current_limit_a", "logic_level_v", "notes"],
        "properties": {
          "port_id": { "$ref": "#/$defs/id" },
          "signal": {
            "enum": [
              "power_in",
              "power_output",
              "ground",
              "digital_output",
              "digital_input",
              "digital_io",
              "pwm_input",
              "pwm_output",
              "i2c",
              "i2c_sda",
              "i2c_scl",
              "motor_output",
              "motor_power",
              "analog_input"
            ]
          },
          "voltage_min_v": { "$ref": "#/$defs/non_negative_or_null" },
          "voltage_max_v": { "$ref": "#/$defs/non_negative_or_null" },
          "current_limit_a": { "$ref": "#/$defs/non_negative_or_null" },
          "logic_level_v": { "$ref": "#/$defs/non_negative_or_null" },
          "notes": { "type": "string" }
        }
      }
    },
    "sourcing": {
      "type": "object",
      "additionalProperties": false,
      "required": [
        "manufacturer_reference_url",
        "datasheet_url",
        "purchase_url",
        "purchase_url_verified_at",
        "price_amount",
        "price_currency",
        "price_checked_at",
        "availability_status"
      ],
      "properties": {
        "manufacturer_reference_url": { "$ref": "#/$defs/url_or_null" },
        "datasheet_url": { "$ref": "#/$defs/url_or_null" },
        "purchase_url": { "$ref": "#/$defs/url_or_null" },
        "purchase_url_verified_at": { "$ref": "#/$defs/date_or_null" },
        "price_amount": {
          "oneOf": [{ "type": "null" }, { "$ref": "#/$defs/decimal_string" }]
        },
        "price_currency": { "type": ["string", "null"], "pattern": "^[A-Z]{3}$" },
        "price_checked_at": { "$ref": "#/$defs/date_or_null" },
        "availability_status": { "enum": ["in_stock", "out_of_stock", "discontinued", "unknown"] }
      },
      "allOf": [
        {
          "description": "Section 9.5: record timestamp and currency for every captured price.",
          "if": { "properties": { "price_amount": { "type": "string" } }, "required": ["price_amount"] },
          "then": { "properties": { "price_currency": { "type": "string" }, "price_checked_at": { "type": "string" } } }
        },
        {
          "description": "A verification date is only meaningful for an actual purchase link.",
          "if": { "properties": { "purchase_url": { "type": "null" } }, "required": ["purchase_url"] },
          "then": { "properties": { "purchase_url_verified_at": { "type": "null" } } }
        }
      ]
    },
    "evidence": {
      "type": "object",
      "additionalProperties": false,
      "required": ["dimensions", "electrical", "price", "notes"],
      "properties": {
        "dimensions": { "$ref": "#/$defs/evidence_level" },
        "electrical": { "$ref": "#/$defs/evidence_level" },
        "price": { "$ref": "#/$defs/evidence_level" },
        "notes": { "type": "array", "items": { "type": "string" } }
      }
    }
  },
  "$defs": {
    "id": { "type": "string", "minLength": 1 },
    "vec3": { "type": "array", "items": { "type": "number" }, "minItems": 3, "maxItems": 3 },
    "non_negative_or_null": { "type": ["number", "null"], "minimum": 0 },
    "decimal_string": {
      "description": "Non-negative decimal amount serialized as a string, e.g. \"12.50\".",
      "type": "string",
      "pattern": "^[0-9]+(\\.[0-9]+)?$"
    },
    "url_or_null": { "type": ["string", "null"], "pattern": "^https?://" },
    "date_or_null": {
      "description": "ISO-8601 date (YYYY-MM-DD) or UTC timestamp ending in Z.",
      "type": ["string", "null"],
      "pattern": "^[0-9]{4}-[0-9]{2}-[0-9]{2}(T[0-9]{2}:[0-9]{2}:[0-9]{2}(\\.[0-9]{1,6})?Z)?$"
    },
    "evidence_level": { "enum": ["verified", "approximated", "synthetic_approximation", "unverified", "unknown"] }
  }
}
