[
 {
  "schema_version": "1.0",
  "catalog_id": "demo.chassis_2wd",
  "identity": {
   "manufacturer": "SYNTHETIC DEMO ONLY",
   "model": "2WD Chassis",
   "sku": null,
   "category": "chassis"
  },
  "physical": {
   "dimensions_mm": {
    "x": 140,
    "y": 12,
    "z": 180
   },
   "mass_g": null,
   "bounds_verified": false,
   "geometry_kind": "procedural",
   "asset_path": null,
   "material_preset": "polymer"
  },
  "mounts": [
   {
    "mount_id": "motor_left",
    "kind": "template_bracket",
    "position_mm": [
     0,
     0,
     0
    ],
    "rotation_deg": [
     0,
     0,
     0
    ],
    "allowed_mates": [
     "template_bracket",
     "electronics_deck"
    ]
   },
   {
    "mount_id": "motor_right",
    "kind": "template_bracket",
    "position_mm": [
     0,
     0,
     0
    ],
    "rotation_deg": [
     0,
     0,
     0
    ],
    "allowed_mates": [
     "template_bracket",
     "electronics_deck"
    ]
   },
   {
    "mount_id": "wheel_left",
    "kind": "template_bracket",
    "position_mm": [
     0,
     0,
     0
    ],
    "rotation_deg": [
     0,
     0,
     0
    ],
    "allowed_mates": [
     "template_bracket",
     "electronics_deck"
    ]
   },
   {
    "mount_id": "wheel_right",
    "kind": "template_bracket",
    "position_mm": [
     0,
     0,
     0
    ],
    "rotation_deg": [
     0,
     0,
     0
    ],
    "allowed_mates": [
     "template_bracket",
     "electronics_deck"
    ]
   },
   {
    "mount_id": "caster_rear",
    "kind": "template_bracket",
    "position_mm": [
     0,
     0,
     0
    ],
    "rotation_deg": [
     0,
     0,
     0
    ],
    "allowed_mates": [
     "template_bracket",
     "electronics_deck"
    ]
   },
   {
    "mount_id": "controller_deck",
    "kind": "template_bracket",
    "position_mm": [
     0,
     0,
     0
    ],
    "rotation_deg": [
     0,
     0,
     0
    ],
    "allowed_mates": [
     "template_bracket",
     "electronics_deck"
    ]
   },
   {
    "mount_id": "driver_deck",
    "kind": "template_bracket",
    "position_mm": [
     0,
     0,
     0
    ],
    "rotation_deg": [
     0,
     0,
     0
    ],
    "allowed_mates": [
     "template_bracket",
     "electronics_deck"
    ]
   },
   {
    "mount_id": "front_sensor",
    "kind": "template_bracket",
    "position_mm": [
     0,
     0,
     0
    ],
    "rotation_deg": [
     0,
     0,
     0
    ],
    "allowed_mates": [
     "template_bracket",
     "electronics_deck"
    ]
   },
   {
    "mount_id": "power_deck",
    "kind": "template_bracket",
    "position_mm": [
     0,
     0,
     0
    ],
    "rotation_deg": [
     0,
     0,
     0
    ],
    "allowed_mates": [
     "template_bracket",
     "electronics_deck"
    ]
   },
   {
    "mount_id": "power_usb",
    "kind": "template_bracket",
    "position_mm": [
     0,
     0,
     0
    ],
    "rotation_deg": [
     0,
     0,
     0
    ],
    "allowed_mates": [
     "template_bracket",
     "electronics_deck"
    ]
   }
  ],
  "ports": [],
  "sourcing": {
   "manufacturer_reference_url": null,
   "datasheet_url": null,
   "purchase_url": null,
   "purchase_url_verified_at": null,
   "price_amount": null,
   "price_currency": null,
   "price_checked_at": null,
   "availability_status": "unknown"
  },
  "evidence": {
   "dimensions": "synthetic_approximation",
   "electrical": "unverified",
   "price": "unknown",
   "notes": [
    "For agent/frontend bootstrapping only; replace with verified specific product metadata before real BOM demo."
   ]
  }
 },
 {
  "schema_version": "1.0",
  "catalog_id": "demo.tt_motor",
  "identity": {
   "manufacturer": "SYNTHETIC DEMO ONLY",
   "model": "Gear Motor",
   "sku": null,
   "category": "motor"
  },
  "physical": {
   "dimensions_mm": {
    "x": 65,
    "y": 24,
    "z": 22
   },
   "mass_g": null,
   "bounds_verified": false,
   "geometry_kind": "procedural",
   "asset_path": null,
   "material_preset": "metal"
  },
  "mounts": [
   {
    "mount_id": "base",
    "kind": "template_bracket",
    "position_mm": [
     0,
     0,
     0
    ],
    "rotation_deg": [
     0,
     0,
     0
    ],
    "allowed_mates": [
     "template_bracket",
     "electronics_deck"
    ]
   },
   {
    "mount_id": "shaft",
    "kind": "template_bracket",
    "position_mm": [
     0,
     0,
     0
    ],
    "rotation_deg": [
     0,
     0,
     0
    ],
    "allowed_mates": [
     "template_bracket",
     "electronics_deck"
    ]
   }
  ],
  "ports": [
   {
    "port_id": "motor_pos",
    "signal": "motor_power",
    "voltage_min_v": null,
    "voltage_max_v": null,
    "current_limit_a": null,
    "logic_level_v": null,
    "notes": "SYNTHETIC DEMO PORT: no electrical rating claimed"
   },
   {
    "port_id": "motor_neg",
    "signal": "motor_power",
    "voltage_min_v": null,
    "voltage_max_v": null,
    "current_limit_a": null,
    "logic_level_v": null,
    "notes": "SYNTHETIC DEMO PORT: no electrical rating claimed"
   }
  ],
  "sourcing": {
   "manufacturer_reference_url": null,
   "datasheet_url": null,
   "purchase_url": null,
   "purchase_url_verified_at": null,
   "price_amount": null,
   "price_currency": null,
   "price_checked_at": null,
   "availability_status": "unknown"
  },
  "evidence": {
   "dimensions": "synthetic_approximation",
   "electrical": "unverified",
   "price": "unknown",
   "notes": [
    "For agent/frontend bootstrapping only; replace with verified specific product metadata before real BOM demo."
   ]
  }
 },
 {
  "schema_version": "1.0",
  "catalog_id": "demo.wheel",
  "identity": {
   "manufacturer": "SYNTHETIC DEMO ONLY",
   "model": "Rubber Wheel",
   "sku": null,
   "category": "wheel"
  },
  "physical": {
   "dimensions_mm": {
    "x": 65,
    "y": 18,
    "z": 65
   },
   "mass_g": null,
   "bounds_verified": false,
   "geometry_kind": "procedural",
   "asset_path": null,
   "material_preset": "rubber"
  },
  "mounts": [
   {
    "mount_id": "base",
    "kind": "template_bracket",
    "position_mm": [
     0,
     0,
     0
    ],
    "rotation_deg": [
     0,
     0,
     0
    ],
    "allowed_mates": [
     "template_bracket",
     "electronics_deck"
    ]
   }
  ],
  "ports": [],
  "sourcing": {
   "manufacturer_reference_url": null,
   "datasheet_url": null,
   "purchase_url": null,
   "purchase_url_verified_at": null,
   "price_amount": null,
   "price_currency": null,
   "price_checked_at": null,
   "availability_status": "unknown"
  },
  "evidence": {
   "dimensions": "synthetic_approximation",
   "electrical": "unverified",
   "price": "unknown",
   "notes": [
    "For agent/frontend bootstrapping only; replace with verified specific product metadata before real BOM demo."
   ]
  }
 },
 {
  "schema_version": "1.0",
  "catalog_id": "demo.caster",
  "identity": {
   "manufacturer": "SYNTHETIC DEMO ONLY",
   "model": "Rear Caster",
   "sku": null,
   "category": "caster"
  },
  "physical": {
   "dimensions_mm": {
    "x": 28,
    "y": 28,
    "z": 28
   },
   "mass_g": null,
   "bounds_verified": false,
   "geometry_kind": "procedural",
   "asset_path": null,
   "material_preset": "metal"
  },
  "mounts": [
   {
    "mount_id": "base",
    "kind": "template_bracket",
    "position_mm": [
     0,
     0,
     0
    ],
    "rotation_deg": [
     0,
     0,
     0
    ],
    "allowed_mates": [
     "template_bracket",
     "electronics_deck"
    ]
   }
  ],
  "ports": [],
  "sourcing": {
   "manufacturer_reference_url": null,
   "datasheet_url": null,
   "purchase_url": null,
   "purchase_url_verified_at": null,
   "price_amount": null,
   "price_currency": null,
   "price_checked_at": null,
   "availability_status": "unknown"
  },
  "evidence": {
   "dimensions": "synthetic_approximation",
   "electrical": "unverified",
   "price": "unknown",
   "notes": [
    "For agent/frontend bootstrapping only; replace with verified specific product metadata before real BOM demo."
   ]
  }
 },
 {
  "schema_version": "1.0",
  "catalog_id": "demo.esp32",
  "identity": {
   "manufacturer": "SYNTHETIC DEMO ONLY",
   "model": "ESP32 Board",
   "sku": null,
   "category": "controller"
  },
  "physical": {
   "dimensions_mm": {
    "x": 55,
    "y": 8,
    "z": 28
   },
   "mass_g": null,
   "bounds_verified": false,
   "geometry_kind": "procedural",
   "asset_path": null,
   "material_preset": "pcb"
  },
  "mounts": [
   {
    "mount_id": "base",
    "kind": "template_bracket",
    "position_mm": [
     0,
     0,
     0
    ],
    "rotation_deg": [
     0,
     0,
     0
    ],
    "allowed_mates": [
     "template_bracket",
     "electronics_deck"
    ]
   }
  ],
  "ports": [
   {
    "port_id": "gpio18",
    "signal": "digital_output",
    "voltage_min_v": null,
    "voltage_max_v": null,
    "current_limit_a": null,
    "logic_level_v": null,
    "notes": "SYNTHETIC DEMO PORT: no electrical rating claimed"
   },
   {
    "port_id": "sda",
    "signal": "i2c",
    "voltage_min_v": null,
    "voltage_max_v": null,
    "current_limit_a": null,
    "logic_level_v": null,
    "notes": "SYNTHETIC DEMO PORT: no electrical rating claimed"
   },
   {
    "port_id": "scl",
    "signal": "i2c",
    "voltage_min_v": null,
    "voltage_max_v": null,
    "current_limit_a": null,
    "logic_level_v": null,
    "notes": "SYNTHETIC DEMO PORT: no electrical rating claimed"
   }
  ],
  "sourcing": {
   "manufacturer_reference_url": null,
   "datasheet_url": null,
   "purchase_url": null,
   "purchase_url_verified_at": null,
   "price_amount": null,
   "price_currency": null,
   "price_checked_at": null,
   "availability_status": "unknown"
  },
  "evidence": {
   "dimensions": "synthetic_approximation",
   "electrical": "unverified",
   "price": "unknown",
   "notes": [
    "For agent/frontend bootstrapping only; replace with verified specific product metadata before real BOM demo."
   ]
  }
 },
 {
  "schema_version": "1.0",
  "catalog_id": "demo.tb6612",
  "identity": {
   "manufacturer": "SYNTHETIC DEMO ONLY",
   "model": "Motor Driver",
   "sku": null,